tg_message_id,tg_chat_id,post_tg_message_id,author_tg_user_id,published_at,text,reaction_count
136,3135516567,128,-1003092938845,2025-10-28T19:53:01+00:00,"Я не пробовала сама, поэтому мерси за отзыв.",1
137,3135516567,128,1925940623,2025-10-28T19:54:37+00:00,"За более 20 лет не встретил ни одного человека, старше 60 лет с достаточным уровнем вит Д 3.  Так, что считаю ,что можно и без анализа пожилым 5000 Д 3 +  к-2 100 мкг в форме МК-7
Это не рекомендация, а моё мнение. Советуйтесь с врачом",2
138,3135516567,128,1925940623,2025-10-28T20:01:41+00:00,"Мои соображения по магнию. Всё таки дозировки маловаты. Оптимум Жен. 300-350, а муж. 400. Это при нормальном уровне, как профилактика, а при дефиците, так называемой магниевой яме для устранения недостатка дозировки в два раза выше.",2
139,3135516567,128,-1003092938845,2025-10-28T20:46:14+00:00,"Дозировки, какбэ, для мозга. Если для мозга и тела, выше, согласна.",0
141,3135516567,140,7785605732,2025-10-28T23:18:55+00:00,"Кортексин нет (но применяли родственники, инъекционно), др пептиды - да. Результат положительный.",1
142,3135516567,128,7785605732,2025-10-28T23:21:36+00:00,Тоже выскажу мнение. Без анализа - 2000 и не более. Особенно пожилым мужчинам.,1
143,3135516567,140,-1003092938845,2025-10-28T23:30:38+00:00,Какие пептиды?,0
144,3135516567,140,7785605732,2025-10-28T23:40:16+00:00,"Пептиды Хавинсона. (Кортексин это тоже его разработка). Из цитомаксов - Церлутен, Нейро 3 плюс,  из цитогенов - Пинеалон. Цитамины не применяли, т.к. это все-таки предыдущее поколение в пептидных технологиях.",1
145,3135516567,140,-1003092938845,2025-10-29T00:01:10+00:00,"Я в процессе формирования мнения, благодарю за инфу.",1
146,3135516567,49,7785605732,2025-10-29T00:21:37+00:00,"Если имеется в виду зеленый чай как БАД (особенно, если это чистый EGCG), то противопоказанием, кроме тех, о которых вам уже написали, являются заболевания печени. Но даже и при абсолютно здоровой печени, чистый EGCG более двух месяцев подряд не рекомендуется (более длительный прием может повреждать гепатоциты). Также еще и дозировки имеют значение.  Кроме того, зеленый чай (и обычный, и в добавках) лучше не совмещать в один прием с молочкой/кисломолочкой и одновременным приемом минералов (кальция, магния и т.п.), желателен перерыв между ними от 2х часов.",0
147,3135516567,38,7785605732,2025-10-29T00:42:08+00:00,"Куркума не столь сильный хелатор, как чистый куркумин (особенно в высокодоступных его формах ). А если ее использовать только как приправу, то вряд ли она окажет какое-то влияние. Что касается куркумина, то да, он хелатирует железо (и др.металлы, кстати), но, в любом случае, ему для этого нужно время. Молниеносного падения ферритина у вас не произойдет. Если следовать принципу умеренности и разумности,  все будет в порядке. Желательно не принимать куркумин более 3х м-цев без перерыва, и по окончании курса контролировать ферритин. При необходимости - восполнять железо. К слову сказать,  куркумин не единственный хелатор железа - кверцетин, ресвератрол,  физетин, виногр.косточка, например - тоже способны с ним связываться и выводить из организма. Просто на этом мало кто акцентирует внимание, хотя не мешало бы.",0
148,3135516567,31,7785605732,2025-10-29T01:03:29+00:00,"При таких дозировках хорошо бы восполнять молибден. Он проседает при употреблении серы. А это детокс и антиоксидантная поддержка, если кратко.",1
149,3135516567,61,1214292601,2025-10-29T01:16:35+00:00,"Покажите, пожалуйста, вашу куркуму. А то когда то давно купила её в виде сухого корня в Дубае, пока молола испортила кофемолку, он очень твёрдый, как камень. Ищу альтернативу, чтобы именно куркума была, а не подделка",0
150,3135516567,140,7864370903,2025-10-29T04:36:08+00:00,"Лично я наблюдал за инъекциями кортексина 50+ детям от 7 лет

Лично я ставил кортексин себе и своим близким

Эффект нулевой.",1
151,3135516567,140,1039414525,2025-10-29T05:11:47+00:00,Я даже не слышала о таком 😂,0
152,3135516567,128,1039414525,2025-10-29T05:26:49+00:00,"Аида, доброе утро! Не подскажите, если в Д уже есть Вит К2 нужно ли его ещё добавить отдельно? Увеличить дозировку для разжижения крови, если густая для пожилых? Или остановится на том,что К есть уже с Д независимо от дозировки?",0
153,3135516567,49,-1003092938845,2025-10-29T09:23:37+00:00,Зеленый чай как чай),0
154,3135516567,38,-1003092938845,2025-10-29T09:41:31+00:00,"Куркумин хелатирует железо, да. Один врач принимал 6 капсул по 538 мг куркумы в день и заработал анемию. Уровень железа, ферритина и гемоглобина восстановился за 2 недели. А а чайной ложке куркумы куркумина 50 мг.",0
155,3135516567,128,-1003092938845,2025-10-29T09:42:16+00:00,А какое соотгошение?,0
157,3135516567,125,1558740046,2025-10-29T11:15:11+00:00,"А посоветуйте хороший рыбий жир! Заранее спасибо, я ваащпе чайник!",0
158,3135516567,125,-1003092938845,2025-10-29T11:16:53+00:00,"Я брала Moller, Now, Нутрилайт.",0
160,3135516567,125,1558740046,2025-10-29T11:21:47+00:00,Благодарю!!!,0
161,3135516567,159,1925940623,2025-10-29T11:25:57+00:00,А как на счёт фосфатидил серина? 100 мг. Он тоже для мозга полезен.?,0
162,3135516567,159,-1003092938845,2025-10-29T11:39:08+00:00,"Полезен, да. Но фосфатидилхолина в мозге больше, и фс может образоваться из фх.",1
163,3135516567,159,1925940623,2025-10-29T11:40:44+00:00,Спасибо.,1
164,3135516567,159,1925940623,2025-10-29T11:56:14+00:00,Подсолнечный лецитин  (фосфатидилхолин ) принимаем.,0
165,3135516567,159,-1003092938845,2025-10-29T11:57:19+00:00,Фирма?,0
167,3135516567,159,1925940623,2025-10-29T12:03:24+00:00,В основном от NOW в порошке иногда от Fearn в гранулах ( соя),1
168,3135516567,166,815110948,2025-10-29T12:07:12+00:00,С Вами интересно и очень познавательно) Спасибо🤝,7
169,3135516567,166,381378654,2025-10-29T12:08:29+00:00,Согласна!🤝,4
170,3135516567,128,1039414525,2025-10-29T12:20:22+00:00,"Д5000 - 125 mcg, K2 mk7 - 50 mcg.",0
171,3135516567,159,6850778234,2025-10-29T12:20:42+00:00,Врач как-то прописал цитиколин+мексидол в уколах #10. Явное улучше6ие почувствовала через месяц,1
172,3135516567,159,1039414525,2025-10-29T12:23:11+00:00,"Я и мои родители уже долго принимаем  лецитин Healthis Россия, там и дозировка не плохая, сейчас у них появилась 2000 мг в 2 капсулах. Не знаю хорошо или нет он.",0
173,3135516567,156,1039414525,2025-10-29T12:29:46+00:00,"Аида, это уколы или добавки?",0
174,3135516567,156,-1003092938845,2025-10-29T13:48:16+00:00,Вполне хорошо перорально,0
175,3135516567,128,-1003092938845,2025-10-29T13:50:46+00:00,"Маловато к2, да",0
176,3135516567,156,1039414525,2025-10-29T13:50:52+00:00,"А где искать цитиколин и альфа-ГФХ, в аптеках?",0
177,3135516567,159,-1003092938845,2025-10-29T13:52:27+00:00,"Почитала про фирму, своих заводов нет.",0
178,3135516567,156,-1003092938845,2025-10-29T13:53:30+00:00,Да,1
179,3135516567,128,1039414525,2025-10-29T14:18:22+00:00,"А какое соотношение норма для К2 если Д 5000 допустим? 200 хорошо или много? Я так понимаю К2 достаточно полезен, особенно кто в возрасте, хотя и мне уже тоже туда))))",0
180,3135516567,128,-1003092938845,2025-10-29T14:29:11+00:00,Больше 200 нет смысла.,1
183,3135516567,159,1925940623,2025-10-29T18:19:53+00:00,"Вот в том то и дело, что большинство так называемых ""производителей"", это никакие не производители, а просто упаковщики. Я также много  раз пытался найти фабрики , предприятия синтезирующие препараты, но к сожалению, практически найти не удалось.",0
184,3135516567,159,-1003092938845,2025-10-29T18:21:20+00:00,Именно так. Я занималась отчетом для минпромторга на эту тему. Просто беда.,0
185,3135516567,128,1370651076,2025-10-29T18:30:18+00:00,"Аида, спасибо) а почему убихиноЛ , а не убихиноН?",0
186,3135516567,128,-1003092938845,2025-10-29T18:32:03+00:00,"Для пожилых лучше, сразу начинает работать, без восстановления.",1
187,3135516567,159,1866683184,2025-10-29T19:02:08+00:00,"А соевый лецитин от Артлайф кто-нибудь пробовал? У них своё огромное производство и говорят, что очень тщательно отбирают сырьё. Пишут на банке, что не ГМО -соя. Я брала как-то, мне зашёл)",1
188,3135516567,128,1370651076,2025-10-29T19:19:43+00:00,"в аптеках только убихиноН , убихинолы на мп , но там не очень доверяю .  Может направите на надежные бренды/продавцов?",0
189,3135516567,128,-1003092938845,2025-10-29T19:21:09+00:00,"У Now есть. Я выписывала прямо у них серрапептазу. Надо еще, кстати",0
190,3135516567,128,1370651076,2025-10-29T19:21:50+00:00,спасибо) вы где ее берете с гарантией что она настоящая ?,0
191,3135516567,128,-1003092938845,2025-10-29T19:22:24+00:00,Раньше из Финляндии выписывала.,0
192,3135516567,128,1370651076,2025-10-29T19:22:30+00:00,"и магний что треонат, что бисглицинат, ищу родителям в порошке , не могу найти)",0
193,3135516567,128,1370651076,2025-10-29T19:23:22+00:00,"ох, а сейчас они не отправляют ? на usmall  еще можно попробовать",0
194,3135516567,128,-1003092938845,2025-10-29T19:23:34+00:00,Есть у Нау тоже,0
195,3135516567,128,-1003092938845,2025-10-29T19:24:21+00:00,В последний раз посылку проипали наши. Не хочу больше.,0
196,3135516567,84,1193834073,2025-10-30T04:33:09+00:00,"Оно же вроде не при высоких температурах, оно томится",0
197,3135516567,159,1039414525,2025-10-30T05:50:03+00:00,Что-то я со своей тревожностью уже теперь настороженно отношусь к Healthis. Подскажите какой тогда подсолнечный лецитин можно купить в России качественный?,0
198,3135516567,84,-1003092938845,2025-10-30T08:51:43+00:00,Уже при 105 вполне себе заметно протекает,0
199,3135516567,159,-1003092938845,2025-10-30T08:57:23+00:00,Это Борис Борисович должен знать),0
200,3135516567,159,1925940623,2025-10-30T10:41:40+00:00,Российский не знаю. Раньше давно пробовал. ОТКАЗАЛСЯ.,1
202,3135516567,201,1193834073,2025-10-31T04:28:26+00:00,"Здравствуйте, протокол - нервы как сталь , не планируете)))?",0
203,3135516567,201,1039414525,2025-10-31T05:15:57+00:00,"Аида,доброе утро! И снова я по поводу железа😂 альфа-липоевая хелатирует железо, не будет ли оно ""вытягивать"" нормальное содержание из организма железо? И по поводу гипотериоза, если он тканевой/латентный, после приема липоевой проверять щитовидку или как быть с ""осторожностью""?  Можно здесь чуть подробно?",0
204,3135516567,201,1039414525,2025-10-31T05:21:43+00:00,"И не подскажите по поводу L- Карнитин фумарат? Чем он отличается от ацетила? И если чуть просрочен Карнитин в капсулах, можно его принимать?",0
205,3135516567,201,1963421488,2025-10-31T05:34:22+00:00,И Карнитин тартрат?,0
206,3135516567,201,-1003092938845,2025-10-31T08:21:32+00:00,Хорошая мысль),0
207,3135516567,201,-1003092938845,2025-10-31T08:29:15+00:00,"Связывает, да, поэтому разнести по времени с приемом железа. С приемом тироксина тоже. Если принимать 2-3 недели, не должно быть проблем. Если больше месяца, чекап.",0
208,3135516567,201,-1003092938845,2025-10-31T08:32:40+00:00,"Не проходит ГЭБ, работает в мышцах.",1
22,1500038483,21,-1001500038483,2023-02-21T07:56:23+00:00,Группа набрана. ⚠️,0
29,1500038483,28,-1001500038483,2023-03-02T08:48:37+00:00,"Спасибо! 
Участник нашелся 🤝",6
31,1500038483,23,-1001500038483,2023-03-03T04:35:00+00:00,,0
55,1500038483,54,-1001500038483,2023-03-14T09:38:17+00:00,Группа на йогу набрана❗️,0
93,1500038483,92,-1001500038483,2023-04-04T01:15:36+00:00,"Доброе утро! ☀️ 
Группа набрана ‼️",4
21,1735952236,20,-1001735952236,2022-03-01T13:09:42+00:00,,0
111,2381061422,110,-1002381061422,2025-12-11T06:04:01+00:00,,0
